2014,Recommending automated extract method refactorings,"Danilo Silva, Ricardo Terra, Marco Tulio Valente",http://dl.acm.org/http://dx.doi.org/10.1145/2597008.2597141," Extract Method is a key refactoring for improving program comprehension. However, recent empirical research shows that refactoring tools designed to automate Extract Methods are often underused. To tackle this issue, we propose a novel approach to identify and rank Extract Method refactoring opportunities that are directly automated by IDE-based refactoring tools. Our approach aims to recommend new methods that hide structural dependencies that are rarely used by the remaining statements in the original method. We conducted an exploratory study to experiment and define the best strategies to compute the dependencies and the similarity measures used by the proposed approach. We also evaluated our approach in a sample of 81 extract method opportunities generated for JUnit and JHotDraw, achieving a precision of 48% (JUnit) and 38% (JHotDraw). "
2014,Identifying and locating interference issues in PHP applications: the case of WordPress,"Laleh Eshkevari, Giuliano Antoniol, James R. Cordy, Massimiliano Di Penta",http://dl.acm.org/http://dx.doi.org/10.1145/2597008.2597153," The large success of Content management Systems (CMS) such as WordPress is largely due to the rich ecosystem of themes and plugins developed around the CMS that allows users to easily build and customize complex Web applications featuring photo galleries, contact forms, and blog pages. However, the design of the CMS, the plugin-based architecture, and the implicit characteristics of the programming language used to develop them (often PHP), can cause interference or unwanted side effects between the resources declared and used by different plugins. This paper describes the problem of interference between plugins in CMS, specifically those developed using PHP, and outlines an approach combining static and dynamic analysis to detect and locate such interference. Results of a case study conducted over 10 WordPress plugins shows that the analysis can help to identify and locate plugin interference, and thus be used to enhance CMS quality assurance. "
2014,Prioritizing maintainability defects based on refactoring recommendations,"Daniela Steidl, Sebastian Eder",http://dl.acm.org/http://dx.doi.org/10.1145/2597008.2597805," As a measure of software quality, current static code analyses reveal thousands of quality defects on systems in brown-field development in practice. Currently, there exists no way to prioritize among a large number of quality defects and developers lack a structured approach to address the load of refactoring. Consequently, although static analyses are often used, they do not lead to actual quality improvement. Our approach recommends to remove quality defects, exemplary code clones and long methods, which are easy to refactor and, thus, provides developers a first starting point for quality improvement. With an empirical industrial Java case study, we evaluate the usefulness of the recommendation based on developers’ feedback. We further quantify which external factors influence the process of quality defect removal in industry software development. "
2014,How the evolution of emerging collaborations relates to code changes: an empirical study,"Sebastiano Panichella, Gerardo Canfora, Massimiliano Di Penta, Rocco Oliveto",http://dl.acm.org/http://dx.doi.org/10.1145/2597008.2597145," Developers contributing to open source projects spontaneously group into ""emerging'' teams, reflected by messages exchanged over mailing lists, issue trackers and other communication means. Previous studies suggested that such teams somewhat mirror the software modularity. This paper empirically investigates how, when a project evolves, emerging teams re-organize themselves-e.g., by splitting or merging. We relate the evolution of teams to the files they change, to investigate whether teams split to work on cohesive groups of files. Results of this study-conducted on the evolution history of four open source projects, namely Apache httpd, Eclipse JDT, Netbeans, and Samba-provide indications of what happens in the project when teams reorganize. Specifically, we found that emerging team splits imply working on more cohesive groups of files and emerging team merges imply working on groups of files that are cohesive from structural perspective. Such indications serve to better understand the evolution of software projects. More important, the observation of how emerging teams change can serve to suggest software remodularization actions. "
2014,On the effect of code regularity on comprehension,"Ahmad Jbara, Dror G. Feitelson",http://dl.acm.org/http://dx.doi.org/10.1145/2597008.2597140," It is naturally easier to comprehend simple code relative to complicated code. Regrettably, there is little agreement on how to effectively measure code complexity. As a result simple generalpurpose metrics are often used, such as lines of code (LOC), Mc- Cabe’s cyclomatic complexity (MCC), and Halstead’s metrics. But such metrics just count syntactic features, and ignore details of the code’s global structure, which may also have an effect on understandability. In particular, we suggest that code regularity—where the same structures are repeated time after time—may significantly reduce complexity, because once one figures out the basic repeated element it is easier to understand additional instances. We demonstrate this by controlled experiments where subjects perform cognitive tasks on different versions of the same basic function. The results indicate that versions with significant regularity lead to better comprehension, while taking similar time, despite being longer and having higherMCC. These results indicate that regularity is another attribute of code that should be taken into account in the context of studying the code’s complexity and comprehension. Moreover, the fact that regularity may compensate for LOC and MCC demonstrates that complexity cannot be decomposed into independently addable contributions by individual attributes. "
2014,Capturing software traceability links from developers' eye gazes,"Braden Walters, Timothy Shaffer, Bonita Sharif, Huzefa Kagdi",http://dl.acm.org/http://dx.doi.org/10.1145/2597008.2597795, The paper presents a novel approach for recovering software traceability links from developers' eye gazes. An eye tracker is used to capture eye gazes while developers perform software maintenance tasks within the Eclipse IDE. An algorithm is presented that establishes a set of traceability links from the eye-gaze data of several developer sessions. A preliminary study assesses the feasibility and validity of the approach. The links generated by the approach were validated by another set of developers. Results indicate that our algorithm achieves strong recall when developers accurately perform bug-localization tasks. 
2014,Comprehension support during knowledge transitions: learning from field,"Vikrant Kaulgud, Annervaz K. M., Janardan Misra, Gary Titus",http://dl.acm.org/http://dx.doi.org/10.1145/2597008.2597804," Knowledge Transition (KT) of legacy applications is a critical activity, often determining the quality of maintenance in the early stages of a maintenance life-cycle. We developed an integrated reverse engineering tool-suite that bootstraps the KT process by providing knowledge recipients insights to application structure, quality and functionality. The tool-suite is based on an in-depth study with KT practitioners and a comparative study of existing tools. We evaluated the benefits of the tool-suite during KT in real-life projects. In this talk, we report our learning from the study and evaluation phases. "
2014,A visualization tool recording historical data of program comprehension tasks,"Katsuhisa Maruyama, Takayuki Omori, Shinpei Hayashi",http://dl.acm.org/http://dx.doi.org/10.1145/2597008.2597802," Software visualization has become a major technique in program comprehension. Although many tools visualize the structure, behavior, and evolution of a program, they have no concern with how a tool user has understood it. Moreover, they miss the stuff the user has left through trial-and-error processes of his/her program comprehension task. This paper presents a source code visualization tool called CodeForest. It uses a forest metaphor to depict source code of Java programs. Each tree represents a class within the program and the collection of trees constitutes a three-dimensional forest. CodeForest helps a user to try a large number of combinations of mapping of software metrics on visual parameters. Moreover, it provides two new types of support: leaving notes that memorize the current understanding and insight along with visualized objects, and automatically recording a user's actions under understanding. The left notes and recorded actions might be used as historical data that would be hints accelerating the current comprehension task. "
2014,An empirical comparison of static and dynamic type systems on API usage in the presence of an IDE: Java vs. groovy with eclipse,"Pujan Petersen, Stefan Hanenberg, Romain Robbes",http://dl.acm.org/http://dx.doi.org/10.1145/2597008.2597152," Several studies have concluded that static type systems offer an advantage over dynamic type systems for programming tasks involving the discovery of a new API. However, these studies did not take into account modern IDE features; the advanced navigation and code completion techniques available in modern IDEs could drastically alter their conclusions. This study describes an experiment that compares the usage of an unknown API using Java and Groovy using the IDE Eclipse. It turns out that the previous finding that static type systems improve the usability of an unknown API still holds, even in the presence of a modern IDE. "
2014,What is the foundation of evidence of human factors decisions in language design? an empirical study on programming language workshops,"Andreas Stefik, Stefan Hanenberg, Mark McKenney, Anneliese Andrews, Srinivas Kalyan Yellanki, Susanna Siebert",http://dl.acm.org/http://dx.doi.org/10.1145/2597008.2597154," In recent years, the programming language design community has engaged in rigorous debate on the role of empirical evidence in the design of general purpose programming languages. Some scholars contend that the language community has failed to embrace a form of evidence that is non-controversial in other disciplines (e.g., medicine, biology, psychology, sociology, physics, chemistry), while others argue that a science of language design is unrealistic. While the discussion will likely persist for some time, we begin here a systematic evaluation of the use of empirical evidence with human users, documenting, paper-by-paper, the evidence provided for human factors decisions, beginning with 359 papers from the workshops PPIG, Plateau, and ESP. This preliminary work provides the following contributions: an analysis of the 1) overall quantity and quality of empirical evidence used in the workshops, and of the 2) overall significant challenges to reliably coding academic papers. We hope that, once complete, this long-term research project will serve as a practical catalog designers can use when evaluating the impact of a language feature on human users. "
2014,"Domain matters: bringing further evidence of the relationships among anti-patterns, application domains, and quality-related metrics in Java mobile apps","Mario Linares-Vásquez, Sam Klock, Collin McMillan, Aminata Sabané, Denys Poshyvanyk, Yann-Gaël Guéhéneuc",http://dl.acm.org/http://dx.doi.org/10.1145/2597008.2597144," Some previous work began studying the relationship between application domains and quality, in particular through the prevalence of code and design smells (e.g., anti-patterns). Indeed, it is generally believed that the presence of these smells degrades quality but also that their prevalence varies across domains. Though anecdotal experiences and empirical evidence gathered from developers and researchers support this belief, there is still a need to further deepen our understanding of the relationship between application domains and quality. Consequently, we present a large-scale study that investigated the systematic relationships between the presence of smells and quality-related metrics computed over the bytecode of 1,343 Java Mobile Edition applications in 13 different application domains. Although, we did not find evidence of a correlation between smells and quality- related metrics, we found (1) that larger differences exist between metric values of classes exhibiting smells and classes without smells and (2) that some smells are commonly present in all the domains while others are most prevalent in certain domains "
2014,SCQAM: a scalable structured code quality assessment method for industrial software,"Shrinath Gupta, Himanshu Kumar Singh, Radhika D. Venkatasubramanyam, Umesh Uppili",http://dl.acm.org/http://dx.doi.org/10.1145/2597008.2597806," Siemens, Corporate Technology, Development Center, Asia Australia (CT DC AA) has been developing and maintaining several software projects for the Industry, Energy, Healthcare, and Infrastructure & Cities sectors of Siemens. The critical nature of these projects necessitates a high level of software code quality. As part of the code quality program at CT DC AA the strategy is to have a scalable method towards identification of issues affecting code quality of projects across the organization. Traditionally, code quality experts in Siemens used EMISQ method to assess code quality. EMISQ requires about three person months (two experts for six weeks) for 50-100 kLoC, making it effort intensive and time consuming. Thus, scaling this assessment method to include the hundreds of projects in CT DC AA poses many challenges. To address this, we have developed a lightweight assessment method called SCQAM (Structured Code Quality Assessment Method). SCQAM is an expert-based method wherein manual assessment of code quality by experts is directed by the systematic application of code analysis tools. In this paper, we describe the SCQAM method, experiences in applying it to projects in CT DC AA, challenges faced and initiatives taken to enable fixing of systemic issues reported by assessments. The insights from our SCQAM experience can provide useful pointers to other organizations and practitioners interested in assessment and improvement of software code quality. "
2014,Repeatedly-executed-method viewer for efficient visualization of execution paths and states in Java,"Toshinori Matsumura, Takashi Ishio, Yu Kashima, Katsuro Inoue",http://dl.acm.org/http://dx.doi.org/10.1145/2597008.2597803," The state of a program at runtime is useful information for developers to understand a program. Omniscient debugging and logging-based tools enable developers to investigate the state of a program at an arbitrary point of time in an execution. While these tools are effective to analyze the state at a single point of time, they might be insufficient to understand the generic behavior of a method which includes various control-flow paths. In this paper, we propose REMViewer (Repeatedly-Executed-Method Viewer), or a tool that visualizes multiple execution paths of a Java method. The tool shows each execution path in a separated view so that developers can firstly select actual execution paths of interest and then compare the state of local variables in the paths. "
2014,A formal evaluation of DepDegree based on weyuker's properties,"Dirk Beyer, Peter Häring",http://dl.acm.org/http://dx.doi.org/10.1145/2597008.2597794," Complexity of source code is an important characteristic that software engineers aim to quantify using static software measurement. Several measures used in practice as indicators for software complexity have theoretical flaws. In order to assess the quality of a software measure, Weyuker established a set of properties that an indicator for program-code complexity should satisfy. It is known that several well-established complexity indicators do not fulfill Weyuker's properties. As an ``early achievement'' in a larger project on evaluating software measures, we show that DepDegree, a measure for data-flow dependencies, satisfies all of Weyuker's properties. "
2014,Hey! are you committing tangled changes?,"Hiroyuki Kirinuki, Yoshiki Higo, Keisuke Hotta, Shinji Kusumoto",http://dl.acm.org/http://dx.doi.org/10.1145/2597008.2597798," Although there is a principle that states a commit should only include changes for a single task, it is not always respected by developers. This means that code repositories often include commits that contain tangled changes. The presence of such tangled changes hinders analyzing code repositories because most mining software repository (MSR) approaches are designed with the assumption that every commit includes only changes for a single task. In this paper, we propose a technique to inform developers that they are in the process of committing tangled changes. The proposed technique utilizes the changes included in the past commits to judge whether a given commit includes tangled changes. If it determines that the proposed commit may include tangled changes, it offers suggestions on how the tangled changes can be split into a set of untangled changes. "
2014,A semiautomated method for classifying program analysis rules into a quality model,"Shrinath Gupta, Himanshu Kumar Singh",http://dl.acm.org/http://dx.doi.org/10.1145/2597008.2597808," Most of the software code quality assessment and monitoring methods uses Quality Model (QM) as an aid to capture quality requirements of the software. An important aspect concerning use of QM is classification of Program Analysis (PA) rules into QM according to their relevance to quality attributes such as maintainability, reliability etc. Currently such classification is performed manually by experts and most of the PA tools (such as FxCop for C#, FindBugs for Java, PC-Lint for C/C++) support hundreds of PA rules. Hence performing classification manually can be very effort intensive and time consuming and can lead to concerns like subjectivity and inconsistency. Hence we propose a light weight semiautomated method to expedite classification and make classification activity less effort intensive. Proposed classifier is based on natural language processing (NLP) techniques and uses a keyword matching algorithm. We have computed precision and recall for such a classifier. We have also shown results from applying technique on classifying rules from FxCop, PC-Lint, and FindBugs into the EMISQ QM. We believe that proposed approach will significantly help in reducing the time required to perform classification and hence also to incorporate newer PA tools and rules into QM based methods. "
2014,An approach for evaluating and suggesting method names using n-gram models,"Takayuki Suzuki, Kazunori Sakamoto, Fuyuki Ishikawa, Shinichi Honiden",http://dl.acm.org/http://dx.doi.org/10.1145/2597008.2597797," Method names are important for the software development process. It has been shown by some studies that the quality of method names affects software comprehension. In response, some approaches that evaluate comprehensibility of method names have been proposed. However, the effectiveness of existing approaches is limited because they focus on part of names.   To deal with the limitation, we propose a novel approach for evaluating comprehensibility of method names and suggesting comprehensible method names using n-gram models. We implemented a prototype tool and conducted two experiments as a case study. Our experiments show that our approach can correctly evaluate 75% method names and successfully suggest 92% actual third words of method names. "
2014,Cross-language bug localization,"Xin Xia, David Lo, Xingen Wang, Chenyi Zhang, Xinyu Wang",http://dl.acm.org/http://dx.doi.org/10.1145/2597008.2597788," Bug localization refers to the process of identifying source code files that contain defects from textual descriptions in bug reports. Existing bug localization techniques work on the assumption that bug reports, and identifiers and comments in source code files, are written in the same language (i.e., English). However, software users from non-English speaking countries (e.g., China) often use their native languages (e.g., Chinese) to write bug reports. For this setting, existing studies on bug localization would not work as the terms that appear in the bug reports do not appear in the source code. We refer to this problem as cross-language bug localization. In this paper, we propose a cross-language bug localization algorithm named CrosLocator, which is based on language translation.   Since different online translators (e.g., Google and Microsoft translators) have different translation accuracies for various texts, CrosLocator uses multiple translators to convert a non-English textual description of a bug report into English -- each bug report would then have multiple translated versions. For each translated version, CrosLocator applies a bug localization technique to rank source code files. Finally, CrosLocator combines the multiple ranked lists of source code files. Our preliminary experiment on Ruby-China shows that CrosLocator could achieve mean reciprocal rank (mrr) and mean average precision (map) scores of up to 0.146 and 0.116, which outperforms a baseline approach by an average of 10% and 12% respectively. "
2014,Automatic documentation generation via source code summarization of method context,"Paul W. McBurney, Collin McMillan",http://dl.acm.org/http://dx.doi.org/10.1145/2597008.2597149," A documentation generator is a programming tool that creates documentation for software by analyzing the statements and comments in the software's source code. While many of these tools are manual, in that they require specially-formatted metadata written by programmers, new research has made inroads towards automatic generation of documentation. These approaches work by stitching together keywords from the source code into readable natural language sentences. These approaches have been shown to be effective, but carry a key limitation: the generated documents do not explain the source code's context. They can describe the behavior of a Java method, but not why the method exists or what role it plays in the software. In this paper, we propose a technique that includes this context by analyzing how the Java methods are invoked. In a user study, we found that programmers benefit from our generated documentation because it includes context information. "
2014,Improving topic model source code summarization,"Paul W. McBurney, Cheng Liu, Collin McMillan, Tim Weninger",http://dl.acm.org/http://dx.doi.org/10.1145/2597008.2597793," In this paper, we present an emerging source code summarization technique that uses topic modeling to select keywords and topics as summaries for source code. Our approach organizes the topics in source code into a hierarchy, with more general topics near the top of the hierarchy. In this way, we present the software's highest-level functionality first, before lower-level details. This is an advantage over previous approaches based on topic models, that only present groups of related keywords without a hierarchy. We conducted a preliminary user study that found our approach selects keywords and topics that the participants found to be accurate in a majority of cases. "
2014,A code obfuscation framework using code clones,"Aniket Kulkarni, Ravindra Metta",http://dl.acm.org/http://dx.doi.org/10.1145/2597008.2597807," IT industry loses tens of billions of dollars annually from security attacks such as malicious reverse engineering. To protect sensitive parts of software from such attacks, we designed a code obfuscation scheme based on nontrivial code clones. While implementing this scheme, we realized that currently there is no framework to assist implementation of such advanced obfuscation techniques. Therefore, we have developed a framework to support code obfuscation using code clones. We could successfully implement our obfuscation technique using this framework in Java. In this paper, we present our framework and illustrate it with an example. "
2014,JCSD: visual support for understanding code control structure,"Ahmad Jbara, Dror G. Feitelson",http://dl.acm.org/http://dx.doi.org/10.1145/2597008.2597801," Program comprehension is a vital mental process in any maintenance activity. It becomes decisive as functions get larger. Such functions are burdened with very many programming constructs as lines of code (LOC) strongly correlate with the McCabe’s cyclomatic complexity (MCC). This makes it hard to capture the whole code of such functions and as a result hinders grasping their structural properties that might be essential for maintenance. Program visualization is known as a key solution that assists in comprehending complex systems. As a matter of fact we have shown, in a recent work, that control structure diagrams (CSD) could be useful to better understand and discover structural properties of such functions. For example, we found that the code regularity property, and even cloning, can be easily identified by CSDs. This paper presents JCSD, which is an Eclipse plug-in that implements CSD diagrams for Java methods. In particular it visualizes the control structure and nesting of a Java method, and by this it easily conveys structural characteristics of the code to the programmer and helps him to better understand and refactor. "
