2010,"Case Study of Feature Location Using Dependence Graph, after 10 Years","Kunrong Chen, Václav Rajlich",http://ieeexplore.ieee.org/xpl/articleDetails.jsp?arnumber=40
2010,Automatic Extraction of a WordNet-Like Identifier Network from Software,"J.-R. Falleri, M. Huchard, M. Lafourcade, C. Nebut, V. Prince, M. Dao",http://ieeexplore.ieee.org/xpl/articleDetails.jsp?arnumber=12
2010,Using Data Fusion and Web Mining to Support Feature Location in Software,"Meghan Revelle, Bogdan Dit, Denys Poshyvanyk",http://ieeexplore.ieee.org/xpl/articleDetails.jsp?arnumber=10
2010,Extracting Source Code from E-Mails,"Alberto Bacchelli, Marco D'Ambros, Michele Lanza",http://ieeexplore.ieee.org/xpl/articleDetails.jsp?arnumber=47
2010,Visual Support for Understanding Product Lines,"Janet Feigenspan, Christian Kästner, Mathias Frisch, Raimund Dachselt, Sven Apel",http://ieeexplore.ieee.org/xpl/articleDetails.jsp?arnumber=15
2010,Patrools: Visualizing the Polymorphic Usage of Class Hierarchies,Petru Florin Mihancea,http://ieeexplore.ieee.org/xpl/articleDetails.jsp?arnumber=35
2010,Renaming Parts of Identifiers Consistently within Code Clones,"Patricia Jablonski, Daqing Hou",http://ieeexplore.ieee.org/xpl/articleDetails.jsp?arnumber=23
2010,DepDigger: A Tool for Detecting Complex Low-Level Dependencies,"Dirk Beyer, Ashgan Fararooy",http://ieeexplore.ieee.org/xpl/articleDetails.jsp?arnumber=52
2010,CheckDep: A Tool for Tracking Software Dependencies,"Dirk Beyer, Ashgan Fararooy",http://ieeexplore.ieee.org/xpl/articleDetails.jsp?arnumber=51
2010,Featureous: A Tool for Feature-Centric Analysis of Java Software,"Andrzej Olszak, Bo Nørregaard Jørgensen",http://ieeexplore.ieee.org/xpl/articleDetails.jsp?arnumber=27
2010,DynaRIA: A Tool for Ajax Web Application Comprehension,"Domenico Amalfitano, Anna Rita Fasolino, Armando Polcaro, Porfirio Tramontana",http://ieeexplore.ieee.org/xpl/articleDetails.jsp?arnumber=16
2010,The ConAn Tool to Identify Crosscutting Concerns in Object Oriented Systems,"Mario Luca Bernardi, Giuseppe Antonio Di Lucca",http://ieeexplore.ieee.org/xpl/articleDetails.jsp?arnumber=34
2010,Unibench: A Tool for Automated and Collaborative Benchmarking,"Daniel Rolls, Carl Joslin, Sven-Bodo Scholz",http://ieeexplore.ieee.org/xpl/articleDetails.jsp?arnumber=36
2010,Recovering Traceability Links between Business Process and Software System Components,"Lerina Aversano, Fiammetta Marulli, Maria Tortorella",http://ieeexplore.ieee.org/xpl/articleDetails.jsp?arnumber=54
2010,Multi-touch for Software Exploration,"Sandro Boccuzzo, Harald C. Gall",http://ieeexplore.ieee.org/xpl/articleDetails.jsp?arnumber=30
2010,Towards Developing a Meta-model for Comprehending Software Adaptability,"Mehdi Amoui, Sen Li, Edson A. Oliveira Jr., Ladan Tahvildari",http://ieeexplore.ieee.org/xpl/articleDetails.jsp?arnumber=50
2010,Sound as an Aid in Understanding Low-Level Program Architecture,Lewis Berman,http://ieeexplore.ieee.org/xpl/articleDetails.jsp?arnumber=55
2010,"SVS, BORS, SVSi: Three Strategies to Relate Problem and Program Domains","Mario M. Berón, Maria João V. Pereira, Nuno Oliveira, Daniela da Cruz",http://ieeexplore.ieee.org/xpl/articleDetails.jsp?arnumber=24
2010,Contract-Based Slicing Helps on Safety Reuse,"Sérgio Areias, Daniela da Cruz, Jorge Sousa Pinto",http://ieeexplore.ieee.org/xpl/articleDetails.jsp?arnumber=44
2010,On the Comparability of Software Clustering Algorithms,"Mark Shtern, Vassilios Tzerpos",http://ieeexplore.ieee.org/xpl/articleDetails.jsp?arnumber=25
2010,On the Equivalence of Information Retrieval Methods for Automated Traceability Link Recovery,"Rocco Oliveto, Malcom Gethers, Denys Poshyvanyk, Andrea De Lucia",http://ieeexplore.ieee.org/xpl/articleDetails.jsp?arnumber=20
2010,Recognizing Sorting Algorithms with the C4.5 Decision Tree Classifier,Ahmad Taherkhani,http://ieeexplore.ieee.org/xpl/articleDetails.jsp?arnumber=11
2010,A Technique for Just-in-Time Clone Detection in Large Scale Systems,"Liliane Barbour, Hao Yuan, Ying Zou",http://ieeexplore.ieee.org/xpl/articleDetails.jsp?arnumber=13
2010,A Simple and Effective Measure for Complex Low-Level Dependencies,"Dirk Beyer, Ashgan Fararooy",http://ieeexplore.ieee.org/xpl/articleDetails.jsp?arnumber=49
2010,Understanding and Auditing the Licensing of Open Source Software Distributions,"Daniel M. German, Massimiliano Di Penta, Julius Davies",http://ieeexplore.ieee.org/xpl/articleDetails.jsp?arnumber=48
2010,Utilizing Web Search Engines for Program Analysis,"Daniel Ratiu, Lars Heinemann",http://ieeexplore.ieee.org/xpl/articleDetails.jsp?arnumber=26
2010,"Vivisection of a Non-Executable, Domain-Specific Language - Understanding (the Usage of) the P3P Language","Ralf Lämmel, Ekaterina Pek",http://ieeexplore.ieee.org/xpl/articleDetails.jsp?arnumber=45
2010,Visualizing the Results of Field Testing,"Brian Chan, Ying Zou, Ahmed E. Hassan, Anand Sinha",http://ieeexplore.ieee.org/xpl/articleDetails.jsp?arnumber=9
2010,Studying the Impact of Social Structures on Software Quality,"Nicolas Bettenburg, Ahmed E. Hassan",http://ieeexplore.ieee.org/xpl/articleDetails.jsp?arnumber=46
2010,An Exploratory Study of Factors Influencing Change Entropy,"Gerardo Canfora, Luigi Cerulo, Massimiliano Di Penta, Francesco Pacilio",http://ieeexplore.ieee.org/xpl/articleDetails.jsp?arnumber=32
2010,Exploring the Relationships between Design Metrics and Package Understandability: A Case Study,Mahmoud O. Elish,http://ieeexplore.ieee.org/xpl/articleDetails.jsp?arnumber=43
2010,Measuring Class Importance in the Context of Design Evolution,"Maen Hammad, Michael L. Collard, Jonathan I. Maletic",http://ieeexplore.ieee.org/xpl/articleDetails.jsp?arnumber=31
2010,A Cognitive Model for Software Architecture Complexity,"Eric Bouwers, Joost Visser, Carola Lilienthal, Arie van Deursen",http://ieeexplore.ieee.org/xpl/articleDetails.jsp?arnumber=28
2010,Natural Language Parsing of Program Element Names for Concept Extraction,"Surafel Lemma Abebe, Paolo Tonella",http://ieeexplore.ieee.org/xpl/articleDetails.jsp?arnumber=29
2010,Identification of Idiom Usage in C++ Generic Libraries,"Andrew Sutton, Ryan Holeman, Jonathan I. Maletic",http://ieeexplore.ieee.org/xpl/articleDetails.jsp?arnumber=37
2010,Aiding Software Maintenance with Copy-and-Paste Clone-Awareness,"Patricia Jablonski, Daqing Hou",http://ieeexplore.ieee.org/xpl/articleDetails.jsp?arnumber=22
2010,Using the Kleinberg Algorithm and Vector Space Model for Software System Clustering,"Giuseppe Scanniello, Anna D'Amico, Carmela D'Amico, Teodora D'Amico",http://ieeexplore.ieee.org/xpl/articleDetails.jsp?arnumber=17
2010,From Program Comprehension to People Comprehension,Andrew Begel,http://ieeexplore.ieee.org/xpl/articleDetails.jsp?arnumber=42
2010,Influence of Synchronized Domain Visualizations on Program Comprehension,"Nuno Oliveira, Maria João Varanda Pereira, Daniela da Cruz, Mario Berón",http://ieeexplore.ieee.org/xpl/articleDetails.jsp?arnumber=21
2010,An Eye Tracking Study on camelCase and under_score Identifier Styles,"Bonita Sharif, Jonathan I. Maletic",http://ieeexplore.ieee.org/xpl/articleDetails.jsp?arnumber=41
2010,My Repository Runneth Over: An Empirical Study on Diversifying Data Sources to Improve Feature Search,"Sukanya Ratanotayanon, Hye Jung Choi, Susan Elliott Sim",http://ieeexplore.ieee.org/xpl/articleDetails.jsp?arnumber=33
2010,Connecting Traces: Understanding Client-Server Interactions in Ajax Applications,"Nick Matthijssen, Andy Zaidman, Margaret-Anne Storey, Ian Bull, Arie van Deursen",http://ieeexplore.ieee.org/xpl/articleDetails.jsp?arnumber=14
