2014,"Innovating in india: designing for constraint, computing for inclusion (keynote)",Edward Cutrell,http://dl.acm.org/http://dx.doi.org/10.1145/2597008.2602160," A fundamental tenet of user-centered design is that the needs, wants, limitations, and contexts of end users are central to the process of creating products and services that can be used and understood by the people who will use them. Most of the time these end users aren’t all that different from the people designing the technology. But as the differences increase between designers and the people they’re designing for, understanding and empathizing with users becomes harder and even more important. As we build software for people and communities with vastly diverse backgrounds, cultures, languages, and education, we need to stretch our ideas of what users want and need and how best to serve them.   The Technology for Emerging Markets (TEM) group at Microsoft Research India seeks to address the needs and aspirations of people in the developing world who are just beginning to use computing technologies and services as well as those for whom access to computing still remains largely out of reach. Much of this work can be described as designing for constraint: constraints in education, in infrastructure, in financial resources, in languages and in many other areas. In this talk, I will describe some work from our group that explores how we have tried to manage these constraints to create software and systems for people and communities often overlooked by technologists. "
2014,The MoJo family: a story about clustering evaluation (invited talk),"Zhihua Wen, Vassilios Tzerpos",http://dl.acm.org/http://dx.doi.org/10.1145/2597008.2602159," The need to decompose large, complex software systems into smaller, more manageable subsystems has been recognized for more than two decades. Many cluster analysis algorithms have been applied to the software domain, and several algorithms specializing in software clustering have been developed. This in turn has created the need to evaluate and compare clustering results.   This talk will present some background on the software clustering problem and its challenges, as well as the software clustering evaluation and its challenges. It will then discuss the MoJo family of measures with an emphasis on MoJoFM (originally presented at IWPC 2004). "
2014,Do architectural design decisions improve the understanding of software architecture? two controlled experiments,"Mojtaba Shahin, Peng Liang, Zengyang Li",http://dl.acm.org/http://dx.doi.org/10.1145/2597008.2597139," Architectural design decision (ADD) and its design rationale, as a paradigm shift on documenting and enriching architecture design description, is supposed to facilitate the understanding of architecture and the reasoning behind the design rationale, which consequently improves the architecting process and gets better architecture design results. But the lack of empirical evaluation that supports this statement is one of the major reasons that prevent industrial practitioners from using ADDs in their daily architecting activities. In this paper, we conducted two controlled experiments, as a family of experiments, to investigate how presence of ADDs can improve the understanding of architecture. The main results of our experiments are: (i) using ADDs and their rationale in architecture documentation does not affect the time needed for completing architecture design tasks; (ii) one experiment and the family of experiments achieved a significantly better understanding of architecture design when using ADDs; and (iii) with regard to the correctness of architecture understanding, more experienced participants benefited more from ADDs in comparison with less experienced ones. "
2014,Revealing the relationship between architectural elements and source code characteristics,"Vanius Zapalowski, Ingrid Nunes, Daltro José Nunes",http://dl.acm.org/http://dx.doi.org/10.1145/2597008.2597156," Understanding how a software system is structured, i.e. its architecture, is crucial for software comprehension. It allows developers to understand an implemented system and reason about how non-functional requirements are addressed. Yet, many systems lack any architectural documentation, or it is often outdated due to software evolution. In current practice, the process of recovering a system's architecture relies primarily on developer knowledge. Although existing architecture recovery approaches can help to identify architectural elements, these approaches require improvement to identify architectural concepts of a system automatically. Towards this goal, we analyze the usefulness of adopting different code-level characteristics to group elements into architectural modules. Our main contributions are an evaluation of the relationships between different sets of characteristics and their corresponding accuracies, and the evaluation results, which help us to understand which characteristics reveal information about the source code structure. Our experiment shows that an identified set of characteristics achieves an average accuracy of 80%, which indicates the usefulness of the considered characteristics for architecture recovery and thus to improving software comprehension. "
2014,Understanding LDA in source code analysis,"David Binkley, Daniel Heinz, Dawn Lawrie, Justin Overfelt",http://dl.acm.org/http://dx.doi.org/10.1145/2597008.2597150," Latent Dirichlet Allocation (LDA) has seen increasing use in the understanding of source code and its related artifacts in part because of its impressive modeling power. However, this expressive power comes at a cost: the technique includes several tuning parameters whose impact on the resulting LDA model must be carefully considered. An obvious example is the burn-in period; too short a burn-in period leaves excessive echoes of the initial uniform distribution. The aim of this work is to provide insights into the tuning parameter's impact. Doing so improves the comprehension of both, 1) researchers who look to exploit the power of LDA in their research and 2) those who interpret the output of LDA-using tools. It is important to recognize that the goal of this work is not to establish values for the tuning parameters because there is no universal best setting. Rather, appropriate settings depend on the problem being solved, the input corpus (in this case, typically words from the source code and its supporting artifacts), and the needs of the engineer performing the analysis. This work's primary goal is to aid software engineers in their understanding of the LDA tuning parameters by demonstrating numerically and graphically the relationship between the tuning parameters and the LDA output. A secondary goal is to enable more informed setting of the parameters. Results obtained using both production source code and a synthetic corpus underscore the need for a solid understanding of how to configure LDA's tuning parameters. "
2014,A diagnosis-based approach to software comprehension,"Alexandre Perez, Rui Abreu",http://dl.acm.org/http://dx.doi.org/10.1145/2597008.2597151," Program comprehension is a time-consuming task performed during the process of reusing, reengineering, and enhancing existing systems. Currently, there are tools to assist in program comprehension by means of dynamic analysis, but, e.g., most cannot identify the topology and the interactions of a certain functionality in need of change, especially when used in large, real-world software applications. We propose an approach, coined Spectrum-based Feature Comprehension (SFC), that borrows techniques used for automatic software-fault-localization, which were proven to be effective even when debugging large applications in resource-constrained environments. SFC analyses the program by exploiting run-time information from test case executions to compute the components that are important for a given feature (and whether a component is used to implement just one feature or more), helping software engineers to understand how a program is structured and what the functionality's dependencies are. We present a toolset, coined Pangolin, that implements SFC and displays its report to the user using an intuitive visualization. A user study with the open-source application Rhino is presented, demonstrating the efficiency of Pangolin in locating the components that should be inspected when changing a certain functionality. "
2014,dsOli: data structure operation location and identification,David H. White,http://dl.acm.org/http://dx.doi.org/10.1145/2597008.2597800," Comprehension of C programs can be a difficult task, especially when they contain pointer-based dynamic data structures. This paper describes our tool dsOli which aims to simplify this problem by automatically locating and identifying data structure operations in C programs, such as inserting into a singly linked list. The approach is based on a dynamic analysis that seeks to identify functional units in a program by observing repetitive temporal patterns caused by multiple invocations of code fragments. The behaviour of these functional units is then classified by matching the associated heap states against templates describing common data structure operations. The analysis results are available to the user via XML output, and can also be viewed using an intuitive GUI which overlays the learnt information on the program source code. "
2014,"Version history, similar report, and structure: putting them together for improved bug localization","Shaowei Wang, David Lo",http://dl.acm.org/http://dx.doi.org/10.1145/2597008.2597148," During the evolution of a software system, a large number of bug reports are submitted. Locating the source code files that need to be fixed to resolve the bugs is a challenging problem. Thus, there is a need for a technique that can automatically figure out these buggy files. A number of bug localization solutions that take in a bug report and output a ranked list of files sorted based on their likelihood to be buggy have been proposed in the literature. However, the accuracy of these tools still need to be improved.   In this paper, to address this need, we propose AmaLgam, a new method for locating relevant buggy files that puts together version history, similar reports, and structure. To do this, AmaLgam integrates a bug prediction technique used in Google which analyzes version history, with a bug localization technique named BugLocator which analyzes similar reports from bug report system, and the state-of-the-art bug localization technique BLUiR which considers structure. We perform a large-scale experiment on four open source projects, namely AspectJ, Eclipse, SWT and ZXing to localize more than 3,000 bugs. Compared with a history-aware bug localization solution of Sisman and Kak, our approach achieves a 46.1% improvement in terms of mean average precision (MAP). Compared with BugLocator, our approach achieves a 24.4% improvement in terms of MAP. Compared with BLUiR, our approach achieves a 16.4% improvement in terms of MAP. "
2014,Understanding the database manipulation behavior of programs,"Nesrine Noughi, Marco Mori, Loup Meurice, Anthony Cleve",http://dl.acm.org/http://dx.doi.org/10.1145/2597008.2597790," Due to the lack of (up-do-date) documentation, software maintenance and evolution processes often necessitate the recovery of a sucient understanding of the software system, before the latter can be adapted to new or changing requirements. To address this problem, several program comprehension techniques have been proposed to support this preliminary phase of software maintenance and evolution. Nevertheless, those techniques generally fail in gaining a complete and accurate understanding in the case of modern data-intensive systems, which are characterized by complex, dynamic and continuous interactions between the application programs and their database. In particular, understanding the database manipulation behavior of a given program involves dierent levels of comprehension ranging from identifying to relating and interpreting the successive database access operations. In this paper, we present our early research achievements in the development of a tool-supported framework aiming to extract and understand the database manipulation behavior of data-intensive programs. "
2014,On mapping releases to commits in open source systems,"Joe F. Shobe, Md Yasser Karim, Motahareh Bahrami Zanjani, Huzefa Kagdi",http://dl.acm.org/http://dx.doi.org/10.1145/2597008.2597792," The paper presents an empirical study on the release naming and structure in three open source projects: Google Chrome, GNU gcc, and Subversion. Their commonality and variability are discussed. An approach is developed that establishes the mapping from a particular release (major or minor) to the specific earliest and latest revisions, i.e., a commit window of a release, in the source control repository. For example, the major release 25.0 in Chrome is mapped to the earliest revision 157687 and latest revision 165096 in the trunk. This mapping between releases and commits would facilitate a systematic choice of history in units of the project evolution scale (i.e., commits that constitute a software release). A projected application is in forming a training set for a source-code change prediction model, e.g., using the association rule mining or machine learning techniques, commits from the source code history are needed. "
2014,Ranking crowd knowledge to assist software development,"Lucas B. L. de Souza, Eduardo C. Campos, Marcelo de A. Maia",http://dl.acm.org/http://dx.doi.org/10.1145/2597008.2597146," StackOverflow.com (SO) is a Question and Answer service oriented to support collaboration among developers in order to help them solving their issues related to software development. In SO, developers post questions related to a programming topic and other members of the site can provide answers to help them. The information available on this type of service is also known as ""crowd knowledge"" and currently is one important trend in supporting activities related to software development and maintenance.   We present an approach that makes use of ""crowd knowledge"" available in SO to recommend information that can assist developers in their activities. This strategy recommends a ranked list of pairs of questions/answers from SO based on a query (list of terms). The ranking criteria is based on two main aspects: the textual similarity of the pairs with respect to the query (the developer's problem) and the quality of the pairs. Moreover, we developed a classifier to consider only ""how-to"" posts. We conducted an experiment considering programming problems on three different topics (Swing, Boost and LINQ) widely used by the software development community to evaluate the proposed recommendation strategy. The results have shown that for 77.14% of the assessed activities, at least one recommended pair proved to be useful concerning the target programming problem. Moreover, for all activities, at least one recommended pair had a source code snippet considered reproducible or almost reproducible. "
2014,How do API changes trigger stack overflow discussions? a study on the Android SDK,"Mario Linares-Vásquez, Gabriele Bavota, Massimiliano Di Penta, Rocco Oliveto, Denys Poshyvanyk",http://dl.acm.org/http://dx.doi.org/10.1145/2597008.2597155," The growing number of questions related to mobile development in StackOverflow highlights an increasing interest of software developers in mobile programming. For the Android platform, 213,836 questions were tagged with Android-related labels in StackOverflow between July 2008 and August 2012. This paper aims at investigating how changes occurring to Android APIs trigger questions and activity in StackOverflow, and whether this is particularly true for certain kinds of changes. Our findings suggest that Android developers usually have more questions when the behavior of APIs is modified. In addition, deleting public methods from APIs is a trigger for questions that are (i) more discussed and of major interest for the community, and (ii) posted by more experienced developers. In general, results of this paper provide important insights about the use of social media to learn about changes in software ecosystems, and establish solid foundations for building new recommenders for notifying developers/managers about important changes and recommending them relevant crowdsourced solutions "
2014,Towards more accurate content categorization of API discussions,"Bo Zhou, Xin Xia, David Lo, Cong Tian, Xinyu Wang",http://dl.acm.org/http://dx.doi.org/10.1145/2597008.2597142," Nowadays, software developers often discuss the usage of various APIs in online forums. Automatically assigning pre-defined semantic categorizes to API discussions in these forums could help manage the data in online forums, and assist developers to search for useful information. We refer to this process as content categorization of API discussions. To solve this problem, Hou and Mo proposed the usage of naive Bayes multinomial, which is an effective classification algorithm.   In this paper, we propose a Cache-bAsed compoSitE algorithm, short formed as CASE, to automatically categorize API discussions. Considering that the content of an API discussion contains both textual description and source code, CASE has 3 components that analyze an API discussion in 3 different ways: text, code, and original. In the text component, CASE only considers the textual description; in the code component, CASE only considers the source code; in the original component, CASE considers the original content of an API discussion which might include textual description and source code. Next, for each component, since different terms (i.e., words) have different affinities to different categories, CASE caches a subset of terms which have the highest affinity scores to each category, and builds a classifier based on the cached terms. Finally, CASE combines all the 3 classifiers to achieve a better accuracy score. We evaluate the performance of CASE on 3 datasets which contain a total of 1,035 API discussions. The experiment results show that CASE achieves accuracy scores of 0.69, 0.77, and 0.96 for the 3 datasets respectively, which outperforms the state-of-the-art method proposed by Hou and Mo by 11%, 10%, and 2%, respectively. "
2014,CODES: mining source code descriptions from developers discussions,"Carmine Vassallo, Sebastiano Panichella, Massimiliano Di Penta, Gerardo Canfora",http://dl.acm.org/http://dx.doi.org/10.1145/2597008.2597799," Program comprehension is a crucial activity, preliminary to any software maintenance task. Such an activity can be difficult when the source code is not adequately documented, or the documentation is outdated. Differently from the many existing software re-documentation approaches, based on different kinds of code analysis, this paper describes CODES (mining sourCe cOde Descriptions from developErs diScussions), a tool which applies a ""social'' approach to software re-documentation. Specifically, CODES extracts candidate method documentation from StackOverflow discussions, and creates Javadoc descriptions from it. We evaluated CODES to mine Lucene and Hibernate method descriptions. The results indicate that CODES is able to extract descriptions for 20% and 28% of the Lucene and Hibernate methods with a precision of 84% and 91% respectively. "
2014,Condensing class diagrams by analyzing design and network metrics using optimistic classification,"Ferdian Thung, David Lo, Mohd Hafeez Osman, Michel R. V. Chaudron",http://dl.acm.org/http://dx.doi.org/10.1145/2597008.2597157," A class diagram of a software system enhances our ability to understand software design. However, this diagram is often unavailable. Developers usually reconstruct the diagram by reverse engineering it from source code. Unfortunately, the resultant diagram is often very cluttered; making it difficult to learn anything valuable from it. Thus, it would be very beneficial if we are able to condense the reverse- engineered class diagram to contain only the important classes depicting the overall design of a software system. Such diagram would make program understanding much easier. A class can be important, for example, if its removal would break many connections between classes. In our work, we estimate this kind of importance by using design (e.g., number of attributes, number of dependencies, etc.) and network metrics (e.g., betweenness centrality, closeness centrality, etc.). We use these metrics as features and input their values to our optimistic classifier that will predict if a class is important or not. Different from standard classification, our newly proposed optimistic classification technique deals with data scarcity problem by optimistically assigning labels to some of the unlabeled data and use them for training a better statistical model. We have evaluated our approach to condense reverse-engineered diagrams of 9 software systems and compared our approach with the state-of-the-art work of Osman et al. Our experiments show that our approach can achieve an average Area Under the Receiver Operating Characteristic Curve (AUC) score of 0.825, which is a 9.1% improvement compared to the state-of-the-art approach. "
2014,An information visualization feature model for supporting the selection of software visualizations,"Renan Vasconcelos, Marcelo Schots, Cláudia Werner",http://dl.acm.org/http://dx.doi.org/10.1145/2597008.2597796," Software development comprises the execution of a variety of tasks, such as bug discovery, finding reusable assets, dependency analysis etc. A better understanding of the task at hand and its surroundings can improve the development performance in general. Software visualizations can support such understanding by addressing different issues according to the necessity of stakeholders. However, knowing which visualizations better fit a given task in progress is not a trivial skill. In this sense, a feature model, intended for organizing the knowledge of a given domain and allowing the reuse of components, can support the identification, categorization and selection of information visualization elements. This work presents an ongoing domain analysis performed for building an information visualization feature model, whose goal is to support the process of choosing and building proper, suitable software visualizations. "
2014,Enabling integrated development environments with natural user interface interactions,"Denis Delimarschi, George Swartzendruber, Huzefa Kagdi",http://dl.acm.org/http://dx.doi.org/10.1145/2597008.2597791, The paper introduces the concept of applying Natural User Interface (NUI) interactions in the context of Integrated Development Environments (IDEs). Human voice and gestures are mapped to several IDE commends. A prototype tool is developed using the Microsoft Kinect hardware sensors and the available software development kits for Microsoft Visual Studio. A pilot study was conducted to assess the developed prototype. The results of the study suggest that it might be possible to apply natural interactions to a range of IDE capabilities. 
2014,"Amalgamating source code authors, maintainers, and change proneness to triage change requests","Md Kamal Hossen, Huzefa Kagdi, Denys Poshyvanyk",http://dl.acm.org/http://dx.doi.org/10.1145/2597008.2597147," The paper presents an approach, namely iMacPro, to recommend developers who are most likely to implement incoming change requests. iMacPro amalgamates the textual similarity between the given change request and source code, change proneness information, authors, and maintainers of a software system. Latent Semantic Indexing (LSI) and a lightweight analysis of source code, and its commits from the software repository, are used. The basic premise of iMacPro is that the authors and maintainers of the relevant source code, which is change prone, to a given change request are most likely to best assist with its resolution. iMacPro unifies these sources in a unique way to perform its task, which was not investigated and reported in the literature previously.   An empirical study on three open source systems, ArgoUML, JabRef, and jEdit , was conducted to assess the effectiveness of iMacPro. A number of change requests from these systems were used in the evaluated benchmark. Recall values for top one, five, and ten recommended developers are reported. Furthermore, a comparative study with a previous approach that uses the source-code authorship information for developer recommendation was performed. Results show that iMacPro could provide recall gains from 30% to 180% over its subjected competitor with statistical significance. "
2014,Mining unit tests for code recommendation,"Mohammad Ghafari, Carlo Ghezzi, Andrea Mocci, Giordano Tamburrelli",http://dl.acm.org/http://dx.doi.org/10.1145/2597008.2597789," Developers spend a significant portion of their time understanding and learning the correct usage of the APIs of libraries they want to integrate in their projects. However, learning how to effectively use APIs is complex and time consuming. Code recommendation systems play a crucial role facilitating developers in this task by providing to them relevant examples while they code. This paper proposes a novel approach to code recommendation in which code examples are automatically obtained by mining and manipulating unit tests. In this paper we discuss the theoretical and practical implications that underpin this idea. The discussion leads to a series of fascinating research challenges that we organized in a research agenda. "
