citing_paper_title,citing_paper_authors,citing_paper_citations,num_cited_papers,cited_paper_titles
Evolutionary safety testing of embedded control software by automatically generating compact test data sequences,"H Pohlheim, M Conrad, A Griep - SAE 2005 World Congress &  , 2005 - pohlheim.com",Cited by 13,1,Side-effect removal transformation
Automatic software generation and improvement through search based techniques,A Arcuri - 2009 - etheses.bham.ac.uk,Cited by 13,1,Side-effect removal transformation
The limitations of genetic algorithms in software testing,"SH Aljahdali, AS Ghiduk - Computer Systems and  , 2010 - ieeexplore.ieee.org",Cited by 10,1,Side-effect removal transformation
On the business impact of software process improvement,"RJ Kusters, JJM Trienekens, W Hassoldt - null, 2002 - computer.org",Cited by 5,1,Side-effect removal transformation
 Improving Evolutionary Testing in the Presence of State Behaviour,"P McMinn - PhD Transfer Report, University of Sheffield, 2002",Cited by 4,1,Side-effect removal transformation
Searching for test data,K Ghani - 2009 - cs.york.ac.uk,Cited by 3,1,Side-effect removal transformation
 GU STT: An Am orphous Slicing System which Com bines,"M Harman, M Munro, L Hu, X Zhang","",1,Side-effect removal transformation
Improving Testability with Stateless Method Extraction,O Dagenais - 2012 - curve.carleton.ca,"",1,Side-effect removal transformation
"Report 3: Thesis Proposal, academic year 2007/2008",D Ghica - Citeseer,"",1,Side-effect removal transformation
A Search Space Reduction System for Evolutionary Testing,"M Harman, R Hierons, C Fox, S Danicic, A Baresel - wivenhoe.demon.co.uk","",1,Side-effect removal transformation
Equivalence hypothesis testing in experimental software engineering,"JJ Dolado, MC Otero, M Harman - Software Quality Journal, 2014 - Springer","",1,Side-effect removal transformation
 DH1 3LE. UK.,"L Hu, R Hierons, M Munro, X Zhang, JJ Dolado - Proceedings, 2002 - IEEE","",1,Side-effect removal transformation
Instrumentation and transformation of Java source code for automated testing with search-based testing algorithms,"K Jansen, MH Bjrdal, TN Gravermoen, KF Seip - 2010 - duo.uio.no","",1,Side-effect removal transformation
:        -," ,   - system-informatics.ru","",1,Side-effect removal transformation
Source code analysis: A road map,"D Binkley - 2007 Future of Software Engineering, 2007 - dl.acm.org",Cited by 165,1,Program simplification as a means of approximating undecidable propositions
A survey of empirical results on program slicing,"D Binkley, M Harman - Advances in Computers, 2004 - Elsevier",Cited by 112,1,Program simplification as a means of approximating undecidable propositions
Pre/post conditioned slicing,"M Harman, R Hierons, C Fox, S Danicic - Proceedings of the IEEE  , 2001 - dl.acm.org",Cited by 70,1,Program simplification as a means of approximating undecidable propositions
ConSIT: A conditioned program slicer,"S Danicic, C Fox, M Harman - Software Maintenance,  , 2000 - ieeexplore.ieee.org",Cited by 53,1,Program simplification as a means of approximating undecidable propositions
An empirical study of amorphous slicing as a program comprehension support tool,"D Binkley, M Harman, LR Raszewski -  . IWPC 2000. 8th  , 2000 - ieeexplore.ieee.org",Cited by 39,1,Program simplification as a means of approximating undecidable propositions
The relationship between program dependence and mutation analysis,"M Harman, R Hierons, S Danicic - Mutation testing for the new century, 2001 - Springer",Cited by 38,1,Program simplification as a means of approximating undecidable propositions
Slicing-based test case generation from uml activity diagrams,"P Samuel, R Mall - ACM SIGSOFT Software Engineering Notes, 2009 - dl.acm.org",Cited by 21,1,Program simplification as a means of approximating undecidable propositions
A Novel Test Case Design Technique Using Dynamic Slicing of UML Sequence Diagrams.,"P Samuel, R Mall - e-Informatica, 2008 - e-informatyka.pl",Cited by 20,1,Program simplification as a means of approximating undecidable propositions
Program analysis and test hypotheses complement,"RM Hierons, M Harman - IEEE ICSE International Workshop on  , 2000 - researchgate.net",Cited by 7,1,Program simplification as a means of approximating undecidable propositions
Formal program reversing by conditioned slicing,"G Villavicencio - Software Maintenance and Reengineering,  , 2003 - ieeexplore.ieee.org",Cited by 7,1,Program simplification as a means of approximating undecidable propositions
 Program Transformation Techniques for Personalizing Interactions with Information Systems,"S Perugini, N Ramakrishnan, EA Fox - 2003 - Ph. D. prelim document. Department  ",Cited by 1,1,Program simplification as a means of approximating undecidable propositions
Pre/Post Conditioned Slicing,"S Danicic, C Fox, M Harman, R Hierons - csee.essex.ac.uk","",1,Program simplification as a means of approximating undecidable propositions
 An Application of Amorphous Program Slicing,"LR Raszewski, D Binkley","",1,Program simplification as a means of approximating undecidable propositions
An automated approach for supporting software reuse via reverse engineering,"GC Gannod, Y Chen -  , 1998. Proceedings. 13th  , 1998 - ieeexplore.ieee.org",Cited by 15,1,Code understanding through program transformation for reusable component identification
Specifying and automatically generating a specialization tool for Fortran 90,"S Blazy - Automated Software Engineering, 2000 - Springer",Cited by 8,1,Code understanding through program transformation for reusable component identification
Modelling Web-Based System with UML Sequence Diagrams,"J Pu, Z Zhang, R Millham, Y Xu - the Proceedings of IADIS  , 2005 - cse.dmu.ac.uk",Cited by 1,1,Code understanding through program transformation for reusable component identification
An approach for extracting business rules from legacy C++ code,"A Jain, S Soner, AS Rathore -   (ICECT), 2011 3rd  , 2011 - ieeexplore.ieee.org",Cited by 1,1,Code understanding through program transformation for reusable component identification
Refactoring Industrial-Strength Code,U Parvez - Citeseer,"",1,Code understanding through program transformation for reusable component identification
Algorithmic Information Theory for Obfuscation Security,"R Mohsen, AM Pinto - 2015 - eprint.iacr.org",Cited by 1,1,On the effect of code regularity on comprehension
When do Software Complexity Metrics Mean Nothing?When Examined out of Context,"JY Gil, G Lalouche - Journal of Object Technology, 2016 - jot.fm","",1,On the effect of code regularity on comprehension
How programmers read regular code: a controlled experiment using eye tracking,"A Jbara, DG Feitelson - Proceedings of the 2015 IEEE 23rd International  , 2015 - dl.acm.org",Cited by 1,1,On the effect of code regularity on comprehension
Regularity of Code: A New Structural Property and its Effect on Code Complexity and Comprehension,A Jbara - 2015 - cs.huji.ac.il,"",1,On the effect of code regularity on comprehension
Software quality and security in teachers' and students' codes when learning a new programming language,"S Boutnaru, A Hershkovitz - Interdisciplinary Journal of e-Skills and  , 2015 - ijello.org","",1,On the effect of code regularity on comprehension
Source Code Interaction on Touchscreens,F Raab - 2016 - epub.uni-regensburg.de,"",1,Toward Intuitive Programming Languages
 COGNITIVE SUPPORT IN SOFTWARE ENGINEERING TOOLS: A DISTRIBUTED COGNITION FRAMEWORK,  - 2002 - SIMON FRASER UNIVERSITY,"",1,Building a research infrastructure for program comprehension observations
Generating parameter comments and integrating with method summaries,"G Sridhara, L Pollock -   (ICPC), 2011 IEEE 19th  , 2011 - ieeexplore.ieee.org",Cited by 31,1,Impact of limited memory resources
Natural language-based software analyses and tools for software maintenance,"L Pollock, K Vijay-Shanker, E Hill, G Sridhara - Software  , 2013 - Springer",Cited by 7,1,Impact of limited memory resources
Confounding parameters on program comprehension: a literature survey,"J Siegmund, J Schumann - Empirical Software Engineering, 2015 - Springer",Cited by 4,1,Impact of limited memory resources
Entwicklung eines erweiterbaren Werkzeugs zur Experimentdurchfhrung ber Programmverstndnis basierend auf der Analyse bereits durchgefhrter  ,"A Hasselberg, M Kppen, G Saake, DIJ Feigenspan - 2011 - wwwiti.cs.uni-magdeburg.de","",1,Impact of limited memory resources
New frontiers of reverse engineering,"G CanforaHarman, M Di Penta - 2007 Future of Software Engineering, 2007 - dl.acm.org",Cited by 145,1,"Theories, methods and tools in program comprehension: Past, present and future"
"Research Methods in Computing: What are they, and how should we teach them?","HJ Holz, A Applin, B Haberman, D Joyce - ACM SIGCSE  , 2006 - dl.acm.org",Cited by 53,1,"Theories, methods and tools in program comprehension: Past, present and future"
Program comprehension of domain-specific and general-purpose languages: comparison using a family of experiments,"T Kosar, M Mernik, JC Carver - Empirical software engineering, 2012 - Springer",Cited by 47,1,"Theories, methods and tools in program comprehension: Past, present and future"
Comprehension strategies and difficulties in maintaining object-oriented systems: An explorative study,"A Karahasanovi, AK Levine, R Thomas - Journal of Systems and Software, 2007 - Elsevier",Cited by 39,1,"Theories, methods and tools in program comprehension: Past, present and future"
Requirements of software visualization tools: A literature survey,"HM Kienle, HA Mller -  and Analysis, 2007. VISSOFT 2007. 4th , 2007 - ieeexplore.ieee.org",Cited by 40,1,"Theories, methods and tools in program comprehension: Past, present and future"
Program comprehension for domain-specific languages,"MJV Pereira, M Mernik, PR Henriques - Computer Science and  , 2008 - doiserbia.nb.rs",Cited by 35,1,"Theories, methods and tools in program comprehension: Past, present and future"
Software evolution comprehension: Replay to the rescue,"L Hattori, M D'Ambros, M Lanza -   (ICPC), 2011 IEEE 19th  , 2011 - ieeexplore.ieee.org",Cited by 27,1,"Theories, methods and tools in program comprehension: Past, present and future"
An ontological software comprehension process model,"W Meng, J Rilling, Y Zhang, R Witte -  , and Ontologies for  , 2006 - cs.concordia.ca",Cited by 26,1,"Theories, methods and tools in program comprehension: Past, present and future"
Intensions are a key to program comprehension.,"V Rajlich - ICPC, 2009 - cs.wayne.edu",Cited by 25,1,"Theories, methods and tools in program comprehension: Past, present and future"
Jype-a program visualization and programming exercise tool for Python,"J Helminen, L Malmi - Proceedings of the 5th international symposium on , 2010 - dl.acm.org",Cited by 24,1,"Theories, methods and tools in program comprehension: Past, present and future"
"RigiAn environment for software reverse engineering, exploration, visualization, and redocumentation","HM Kienle, HA Mller - Science of Computer Programming, 2010 - Elsevier",Cited by 21,1,"Theories, methods and tools in program comprehension: Past, present and future"
Block Model: an educational model of program comprehension as a tool for a scholarly approach to teaching,"C Schulte - Proceedings of the Fourth international Workshop on  , 2008 - dl.acm.org",Cited by 21,1,"Theories, methods and tools in program comprehension: Past, present and future"
Expressiveness and effectiveness of program comprehension: thoughts on future research directions,"JI Maletic, H Kagdi - Frontiers of Software Maintenance, 2008 - researchgate.net",Cited by 19,1,"Theories, methods and tools in program comprehension: Past, present and future"
Program inspection to interconnect behavioral and operational view for program comprehension,"M Bern, P Henriques, MJ Pereira, R Uzal - 2007 - bibliotecadigital.ipb.pt",Cited by 20,1,"Theories, methods and tools in program comprehension: Past, present and future"
Jtourbus: Simplifying program understanding by documentation that provides tours through the source code,"C Oezbek, L Prechelt - Software Maintenance, 2007. ICSM  , 2007 - ieeexplore.ieee.org",Cited by 18,1,"Theories, methods and tools in program comprehension: Past, present and future"
"Bits of history, challenges for the future and autonomic computing technology","HA Mller - Reverse Engineering, 2006. WCRE'06. 13th  , 2006 - ieeexplore.ieee.org",Cited by 15,1,"Theories, methods and tools in program comprehension: Past, present and future"
Package fingerprints: A visual summary of package interface usage,"H Abdeen, S Ducasse, D Pollet, I Alloui - Information and Software  , 2010 - Elsevier",Cited by 15,1,"Theories, methods and tools in program comprehension: Past, present and future"
The effect of task order on the maintainability of object-oriented software,"AI Wang, E Arisholm - Information and Software Technology, 2009 - Elsevier",Cited by 13,1,"Theories, methods and tools in program comprehension: Past, present and future"
Feature location and extraction using landmarks and barriers,"N Walkinshaw, M Roper, M Wood -   Maintenance, 2007. ICSM  , 2007 - ieeexplore.ieee.org",Cited by 13,1,"Theories, methods and tools in program comprehension: Past, present and future"
Sonification design guidelines to enhance program comprehension,"K Hussein, E Tilevich, II Bukvic -  , 2009. ICPC'09. IEEE  , 2009 - ieeexplore.ieee.org",Cited by 11,1,"Theories, methods and tools in program comprehension: Past, present and future"
Empirical evaluation of diagrams of the run-time structure for coding tasks,"N Ammar, M Abi-Antoun - Reverse Engineering (WCRE), 2012  , 2012 - ieeexplore.ieee.org",Cited by 11,1,"Theories, methods and tools in program comprehension: Past, present and future"
Categorization of concerns: a categorical program comprehension model,"T Frey, M Gelhausen, G Saake - Proceedings of the 3rd ACM SIGPLAN  , 2011 - dl.acm.org",Cited by 10,1,"Theories, methods and tools in program comprehension: Past, present and future"
Tracking and visualizing information flow in component-based systems,"AR Yazdanshenas, L Moonen -   Comprehension (ICPC), 2012  , 2012 - ieeexplore.ieee.org",Cited by 10,1,"Theories, methods and tools in program comprehension: Past, present and future"
An Ontology-based Program Comprehension Model,Y Zhang - 2007 - Citeseer,Cited by 10,1,"Theories, methods and tools in program comprehension: Past, present and future"
Tool support for automated traceability of test/code artifacts in embedded software systems,"C Wiederseiner, V Garousi - Trust, Security and Privacy , 2011 - ieeexplore.ieee.org",Cited by 9,1,"Theories, methods and tools in program comprehension: Past, present and future"
Beyond information silosan omnipresent approach to software evolution,"J Rilling, R Witte, P Schuegerl - International Journal of  , 2008 - World Scientific",Cited by 9,1,"Theories, methods and tools in program comprehension: Past, present and future"
Software knowledge capture and acquisition: tool support for agile settings,"FF Correia, A Aguiar - 2009 Fourth International Conference on  , 2009 - computer.org",Cited by 9,1,"Theories, methods and tools in program comprehension: Past, present and future"
Story-driven approach to software evolution,"J Rilling, WJ Meng, R Witte, P Charland - Software, IET, 2008 - ieeexplore.ieee.org",Cited by 8,1,"Theories, methods and tools in program comprehension: Past, present and future"
Empirical Comparison of FOSD Approaches Regarding Program ComprehensionA Feasibility Study,J Feigenspan - 2009 - Citeseer,Cited by 15,1,Building a research infrastructure for program comprehension observations
Software Visualization-A Process Perspective,"J Rilling, WJ Meng, F Chen - Visualizing Software for  , 2007 - ieeexplore.ieee.org",Cited by 7,1,"Theories, methods and tools in program comprehension: Past, present and future"
An empirical study of spreadsheet authors' mental models in explaining and debugging tasks,"B Kankuzi, J Sajaniemi -   (VL/HCC), 2013 IEEE Symposium on, 2013 - ieeexplore.ieee.org",Cited by 6,1,"Theories, methods and tools in program comprehension: Past, present and future"
Answering software evolution questions: An empirical evaluation,"L Hattori, M D'Ambros, M Lanza, M Lungu - Information and Software  , 2013 - Elsevier",Cited by 5,1,"Theories, methods and tools in program comprehension: Past, present and future"
Embedding Model Specifications in Object-Oriented Program Code: A Bottom-up Approach for Model-based Software Development,M Balz - 2011 - duepublico.uni-duisburg-essen.de,Cited by 5,1,"Theories, methods and tools in program comprehension: Past, present and future"
A study on guiding programmers' code navigation with a graphical code recommender,"S Lee, S Kang - Software Engineering Research, Management and  , 2012 - Springer",Cited by 5,1,"Theories, methods and tools in program comprehension: Past, present and future"
A context-driven software comprehension process model,"WJ Meng, J Rilling, Y Zhang, R Witte -  , 2006. SE'06.  , 2006 - ieeexplore.ieee.org",Cited by 5,1,"Theories, methods and tools in program comprehension: Past, present and future"
The VIVIDE programming environment: connecting run-time information with programmers' system knowledge,"M Taeumel, B Steinert, R Hirschfeld - Proceedings of the ACM  , 2012 - dl.acm.org",Cited by 4,1,"Theories, methods and tools in program comprehension: Past, present and future"
"Quick introduction to programming with an integrated code editor, automatic assessment and visual debugging toolwork in progress","J Helminen, L Malmi, A Korhonen - Koli Calling 2009, 2010 - it.uu.se",Cited by 4,1,"Theories, methods and tools in program comprehension: Past, present and future"
Application Domain Name-Based Analysis1,"P Vclavk - Journal of Computer Science and Control  , 2009 - search.proquest.com",Cited by 4,1,"Theories, methods and tools in program comprehension: Past, present and future"
Comment analysis for program comprehension,JLF Freitas - 2011 - repositorium.sdum.uminho.pt,Cited by 4,1,"Theories, methods and tools in program comprehension: Past, present and future"
Design pattern directed clustering for understanding open source code,"Z Han, L Wang, L Yu, X Chen -  , 2009. ICPC'09. IEEE  , 2009 - ieeexplore.ieee.org",Cited by 4,1,"Theories, methods and tools in program comprehension: Past, present and future"
Assessing the influence of import-coupling on OCL expression maintainability: A cognitive theory-based perspective,"L Reynoso, E Manso, M Genero, M Piattini - Information Sciences, 2010 - Elsevier",Cited by 3,1,"Theories, methods and tools in program comprehension: Past, present and future"
Architecture-based software reengineering,"P Dugerdil - Isnet62 Project, 2006 - campus.hesge.ch",Cited by 3,1,"Theories, methods and tools in program comprehension: Past, present and future"
Using software analysis tools to understand military applications,"P Charland, D Dessureault, M Lizotte, D Ouellet - 2006 - cradpdf.drdc.gc.ca",Cited by 3,1,"Theories, methods and tools in program comprehension: Past, present and future"
15 Years of Program Comprehension,"S Tilley - null, 2007 - computer.org",Cited by 3,1,"Theories, methods and tools in program comprehension: Past, present and future"
Software design metrics for predicting maintainability of service-oriented software,M Perepletchikov - 2009 - researchbank.rmit.edu.au,Cited by 3,1,"Theories, methods and tools in program comprehension: Past, present and future"
Evaluation criteria of software visualization systems used for program comprehension,"M Bern, D Cruz, MJ Pereira, P Henriques, R Uzal - 2008 - bibliotecadigital.ipb.pt",Cited by 4,1,"Theories, methods and tools in program comprehension: Past, present and future"
AId: uma Ferramenta para anlise de identificadores de programas Java,"J Azcurra, M Bern, G Montejano - CoNaIISI 2014-2  , 2014 - bibliotecadigital.ipb.pt",Cited by 4,1,"Theories, methods and tools in program comprehension: Past, present and future"
Using robustness diagrams to help with software understanding,"P Dugerdil, J Belmonte, D Kony - International journal of software  , 2009 - doc.rero.ch",Cited by 2,1,"Theories, methods and tools in program comprehension: Past, present and future"
Applying program comprehension techniques to karel robot programs,"N Oliveira, PR Henriques, D Da Cruz -  , 2009. IMCSIT'09.  , 2009 - ieeexplore.ieee.org",Cited by 2,1,"Theories, methods and tools in program comprehension: Past, present and future"
Cognitive support in software engineering tools: A distributed cognition framework,A Walenstein - 2002 - Citeseer,Cited by 77,1,Building a research infrastructure for program comprehension observations
Everyday practices of agile software developers,JR Prior - 2011 - opus.lib.uts.edu.au,Cited by 2,1,"Theories, methods and tools in program comprehension: Past, present and future"
Degradation archaeology: studying software flaws' evolution,"A Lozano, M Wermelinger - Proc. of the ERCIM  , 2006 - researchgate.net",Cited by 2,1,"Theories, methods and tools in program comprehension: Past, present and future"
Patterns and Tools for improving Framework Understanding: a Collaborative Approach,"N Flores, A Aguiar - 2009 Fourth International Conference on  , 2009 - computer.org",Cited by 2,1,"Theories, methods and tools in program comprehension: Past, present and future"
Merits and pitfalls of programming learning objects: a pilot study,"R Matthews, HS Hin, KA Choo -   of the 10th international conference on  , 2012 - dl.acm.org",Cited by 2,1,"Theories, methods and tools in program comprehension: Past, present and future"
A small primer on software reverse engineering,"HA Muller, HM Kienle - 2009 - researchgate.net",Cited by 2,1,"Theories, methods and tools in program comprehension: Past, present and future"
Empirical Assessment of UML Class Diagram Layouts Based on Architectural Importance,B Sharif - 2010 - rave.ohiolink.edu,Cited by 2,1,"Theories, methods and tools in program comprehension: Past, present and future"
Autofolding for Source Code Summarization,"J Fowkes, R Ranca, M Allamanis, M Lapata - arXiv preprint arXiv: , 2014 - arxiv.org",Cited by 2,1,"Theories, methods and tools in program comprehension: Past, present and future"
The impact of tools supported in integrated-development environments on program comprehension,"T Kosar, M Mernik, JC Carver -  ITI), Proceedings of the ITI 2011  , 2011 - ieeexplore.ieee.org",Cited by 2,1,"Theories, methods and tools in program comprehension: Past, present and future"
Program inspection to inter-connect the operational and behavioral views for program comprehension,"MM Bern13, PR Henriques, MJ Varanda, R Uzal - cs.york.ac.uk",Cited by 2,1,"Theories, methods and tools in program comprehension: Past, present and future"
Patterns for understanding frameworks,"N Flores, A Aguiar - Proceedings of the 15th Conference on Pattern  , 2008 - dl.acm.org",Cited by 2,1,"Theories, methods and tools in program comprehension: Past, present and future"
The information gathering strategies of API learners,"E Duala-Ekoko, MP Robillard - 2010 - Citeseer",Cited by 2,1,"Theories, methods and tools in program comprehension: Past, present and future"
Lesen im Informatikunterricht.,"C Schulte - INFOS, 2007 - w3.inf.fu-berlin.de",Cited by 3,1,"Theories, methods and tools in program comprehension: Past, present and future"
Proposta de um sistema para compreenso de aplicaes Web,"E Oliveira, P Henriques, MJ Pereira - 2006 - bibliotecadigital.ipb.pt",Cited by 3,1,"Theories, methods and tools in program comprehension: Past, present and future"
Simplificando la comprensin de programas a travs de la interconexin de dominios,"M Bern, PR Henriques -   de Ciencias de la  , 2008 - sedici.unlp.edu.ar",Cited by 2,1,"Theories, methods and tools in program comprehension: Past, present and future"
"",   - 2011 - ir.library.osaka-u.ac.jp,Cited by 2,1,"Theories, methods and tools in program comprehension: Past, present and future"
Feature Mining: Semiautomatische Transition von (Alt-) Systemen zu Software-Produktlinien,A Dreiling - 2010 - wwwiti.cs.uni-magdeburg.de,Cited by 2,1,"Theories, methods and tools in program comprehension: Past, present and future"
 udos ,"  -  D, 2007 - search.ieice.org",Cited by 2,1,"Theories, methods and tools in program comprehension: Past, present and future"
An Exploratory Study on How Can Diagramming Tools Help Support Programming Activities,"S Lee, GC Murphy, T Fritz, M Allen - ftp-admin.cs.ubc.ca",Cited by 1,1,"Theories, methods and tools in program comprehension: Past, present and future"
UNDERSTANDING OF HETEROGENEOUS MULTI-STAGE META-PROGRAMS,"V tuikys, R Damaeviius, G Ziberkas - Information Technology And , 2012 - eejournal.ktu.lt",Cited by 1,1,"Theories, methods and tools in program comprehension: Past, present and future"
Open source programmers' information seeking,KY Sharif - 2012 - ulir.ul.ie,Cited by 1,1,"Theories, methods and tools in program comprehension: Past, present and future"
Hypermodelling: Next Level Software Engineering with Data Warehouses,T Frey - 2013 - books.google.com,Cited by 1,1,"Theories, methods and tools in program comprehension: Past, present and future"
Explaining visual changes in web interfaces,"B Burg, AJ Ko, MD Ernst - Proceedings of the 28th Annual ACM  , 2015 - dl.acm.org",Cited by 2,1,"Theories, methods and tools in program comprehension: Past, present and future"
An Eclipse Plugin for the Automated Reverse-Engineering of Software Programs,"P Dugerdil, D Kony, J Belmonte - 2009 Sixth International Conference  , 2009 - computer.org",Cited by 1,1,"Theories, methods and tools in program comprehension: Past, present and future"
Overview of Program Comprehension,"W Kechao, W Tiantian, S Xiaohong -  Conference on Computer , 2012 - computer.org",Cited by 1,1,"Theories, methods and tools in program comprehension: Past, present and future"
