citing_paper_title,citing_paper_authors,citing_paper_citations,num_cited_papers,cited_paper_titles
Understanding how reverse engineers make sense of programs from assembly language representations,AR Bryant - 2012 - DTIC Document,Cited by 1,1,"Theories, methods and tools in program comprehension: Past, present and future"
Evaluating a Disruptive Innovation: Function Extraction Technology in Software Development,"R Collins, A Hevner, R Linger - System Sciences (HICSS), 2011 , 2011 - ieeexplore.ieee.org",Cited by 1,1,"Theories, methods and tools in program comprehension: Past, present and future"
"Refinement and Extension of SMDM, a Method for Defining Valid Measures.","L Reynoso, M Genero, M Piattini - J. UCS, 2010 - jucs.org",Cited by 1,1,"Theories, methods and tools in program comprehension: Past, present and future"
"Code, camera, action: how software developers document and share program knowledge using YouTube","L MacLeod, MA Storey, A Bergen - Proceedings of the 2015 IEEE 23rd  , 2015 - dl.acm.org",Cited by 1,1,"Theories, methods and tools in program comprehension: Past, present and future"
"","   - , 2013 - cqvip.com",Cited by 1,1,"Theories, methods and tools in program comprehension: Past, present and future"
Domain-Driven Reverse Architecting (DDRA),P Dugerdil - 2008 - campus.hesge.ch,Cited by 1,1,"Theories, methods and tools in program comprehension: Past, present and future"
Analisis dinamico para la creacion de estrategias de comprension de programas,"H Bernardis, M Bern, DE Riesco - XIV Workshop de  , 2012 - sedici.unlp.edu.ar",Cited by 1,1,"Theories, methods and tools in program comprehension: Past, present and future"
 GCC  AST  C ,"   - , 2010 - journal.hit.edu.cn",Cited by 1,1,"Theories, methods and tools in program comprehension: Past, present and future"
"", - 2012 - library.naist.jp,Cited by 1,1,"Theories, methods and tools in program comprehension: Past, present and future"
Comparing Programming in POSH and GOAL,"R Korstanje, C Brom, J Gemrot, KV Hindriks - artemis.ms.mff.cuni.cz","",1,"Theories, methods and tools in program comprehension: Past, present and future"
PARTITIONING OBJECT-ORIENTED SOURCE CODE FOR,N Walkinshaw - 2006 - cs.le.ac.uk,"",1,"Theories, methods and tools in program comprehension: Past, present and future"
Understanding source code through projectional editor,"J Juhar, L Vokorokos - Engineering of Modern Electric Systems  , 2015 - ieeexplore.ieee.org","",1,"Theories, methods and tools in program comprehension: Past, present and future"
 Application of Artificial Intelligence methods in Finding Program Comprehension Differences in Novice Object Oriented Programmers,"M Ahmadzadeh, E Mahmoudabadi - INTERNATIONAL JOURNAL OF COMPUTERS  , 2013","",1,"Theories, methods and tools in program comprehension: Past, present and future"
Exploring Characteristics of Code Churn,JM Kraaijeveld - 2013 - repository.tudelft.nl,"",1,"Theories, methods and tools in program comprehension: Past, present and future"
Comment-based concept location over system dependency graphs,"N Pereira, MJ Pereira - 3rd Symposium on  , 2014 - bibliotecadigital.ipb.pt",Cited by 1,1,"Theories, methods and tools in program comprehension: Past, present and future"
A knowledge based reengineering approach via ontology and description logic.,H Zhou - 2011 - v00dor00001d.dmu.ac.uk,"",1,"Theories, methods and tools in program comprehension: Past, present and future"
Understanding Dynamic Software Behavior with Tools for Retroactive Investigation,B Burg - 2015 - dlib.lib.washington.edu,"",1,"Theories, methods and tools in program comprehension: Past, present and future"
"Norwegian University of Science and Technology (NTNU), Dept. of Computer and Information Science (IDI), Technical Report IDI-TR-02-07, ISSN: 1503-416X","AI Wang, E Arisholm - 2007 - idi.ntnu.no","",1,"Theories, methods and tools in program comprehension: Past, present and future"
Program understanding using ontologies and dynamic analysis,J Belmonte Torrejon - 2014 - archive-ouverte.unige.ch,"",1,"Theories, methods and tools in program comprehension: Past, present and future"
Empirical validation of CodeCity: A controlled experiment,"R Wettel, M Lanza, R Robbes - 2010 - wettel.github.io",Cited by 3,1,Designing your next empirical study on program comprehension
A unified approach to feature-centric analysis of object-oriented software,"A Olszak, BN Jrgensen - Informatics, 2010 - actapress.com","",1,"Theories, methods and tools in program comprehension: Past, present and future"
An Algorithm of Program Comprehension and Visual Representation for Object-Oriented Program,"H Gu, D Lin - Emerging Research in Artificial Intelligence and  , 2011 - Springer","",1,"Theories, methods and tools in program comprehension: Past, present and future"
Improving JavaScript Development Productivity by Providing Runtime Information within the Code Editor,A Troberg - 2015 - aaltodoc.aalto.fi,"",1,"Theories, methods and tools in program comprehension: Past, present and future"
Opening up Architectures of Software-Intensive Systems: A Functional Decomposition to Support System Comprehension,"P Charland, D Ouellet, D Dessureault, M Lizotte - 2007 - DTIC Document","",1,"Theories, methods and tools in program comprehension: Past, present and future"
Automatic derivation of domain terms and concept location based on the analysis of the identifiers,"P Vaclavik, J Poruban, M Mezei - arXiv preprint arXiv:1003.1399, 2010 - arxiv.org","",1,"Theories, methods and tools in program comprehension: Past, present and future"
A review of source code projections in integrated development environments,"J Juhar, L Vokorokos - Computer Science and Information  , 2015 - ieeexplore.ieee.org","",1,"Theories, methods and tools in program comprehension: Past, present and future"
Eclipse as a Tool for Program Understanding,M Knau - ncstrl.informatik.uni-stuttgart.de,"",1,"Theories, methods and tools in program comprehension: Past, present and future"
Tool support for security code review on smart cards,M Verstraelen - dare.uva.nl,"",1,"Theories, methods and tools in program comprehension: Past, present and future"
Assessing Program Comprehension Tools with the Communicability Evaluation Method,"D Pinheiro, M Maia, R Prates, R Bigonha - lbd.dcc.ufmg.br","",1,"Theories, methods and tools in program comprehension: Past, present and future"
Panorama-a software maintenance tool,NBR Vattumalli - 2010 - lib.dr.iastate.edu,"",1,"Theories, methods and tools in program comprehension: Past, present and future"
INSIGHT: a Semantic Visual Analytics for Programming Discussion Forums,"P Awasthi, IH Hsaio - ceur-ws.org","",1,"Theories, methods and tools in program comprehension: Past, present and future"
Advanced software-based seRvice provisioning and migraTIon of legacy Software,"R Partner, TU Wien - 2014 - artist-project.eu","",1,"Theories, methods and tools in program comprehension: Past, present and future"
TASSAL: Autofolding for Source Code Summarization,"J Fowkes, P Chanthirasegaran, R Ranca, M Allamanis - homepages.inf.ed.ac.uk","",1,"Theories, methods and tools in program comprehension: Past, present and future"
Reviving Literate Programming,FF Correia - 2008 - fe.up.pt,"",1,"Theories, methods and tools in program comprehension: Past, present and future"
Improving software maintenance efficiency with behavior-based cognitive models,"R Bayer, AE Milewski -  , Man and Cybernetics, 2008. SMC 2008 , 2008 - ieeexplore.ieee.org","",1,"Theories, methods and tools in program comprehension: Past, present and future"
Building extensions for applications: Towards the understanding of extension possibilities,"M Aly, A Charfi, M Mezini - Program Comprehension (ICPC),  , 2013 - ieeexplore.ieee.org","",1,"Theories, methods and tools in program comprehension: Past, present and future"
Functionality based refactoring: improving source code comprehension,JL Beiko - 2008 - qspace.library.queensu.ca,"",1,"Theories, methods and tools in program comprehension: Past, present and future"
Categorization of Concerns,"T Frey, M Gelhausen, G Saake - ecs.victoria.ac.nz","",1,"Theories, methods and tools in program comprehension: Past, present and future"
Meta-Programming Task Specification Using Feature-Based Patterns and Domain Program Scenarios,"V tuikys, R Damaeviius - Meta-Programming and Model-Driven Meta- , 2013 - Springer","",1,"Theories, methods and tools in program comprehension: Past, present and future"
Source Code Seeking on the Web: A Survey of Empirical Studies and Tools,"RE Gallardo-Valencia, SE Sim - 2014 - books.google.com","",1,"Theories, methods and tools in program comprehension: Past, present and future"
Program comprehension levels of abstraction for novices,"A Shargabi, SA Aljunid, M Annamalai - Computer,  , 2015 - ieeexplore.ieee.org","",1,"Theories, methods and tools in program comprehension: Past, present and future"
Methodology for Introducing Concurrency into Sequential Programs,X Xu - 2015 - ruor.uottawa.ca,"",1,"Theories, methods and tools in program comprehension: Past, present and future"
A Method for Displaying Relations between Classes and Packages in Object-Oriented Programs,"M Sayedi, K Kaseb, R Mirzaei - research.uok.ac.ir","",1,"Theories, methods and tools in program comprehension: Past, present and future"
Embedding model specifications in object-oriented program code,M Balz - 2012 - duepublico.uni-duisburg-essen.de,"",1,"Theories, methods and tools in program comprehension: Past, present and future"
Program comprehension with four-layered mental model,"M Nosal, J Poruban - Engineering of Modern Electric Systems ( , 2015 - ieeexplore.ieee.org","",1,"Theories, methods and tools in program comprehension: Past, present and future"
Concept Location based on System Dependency Graphs,NFG Pereira - 2015 - repositorium.sdum.uminho.pt,"",1,"Theories, methods and tools in program comprehension: Past, present and future"
User evaluation of a domain specific program comprehension tool,"L Moonen - Proceedings of the First International Workshop on  , 2012 - dl.acm.org","",1,"Theories, methods and tools in program comprehension: Past, present and future"
Visual Representation of a Customizable Software Maintenance Process Model,F Chen - 2009 - Citeseer,"",1,"Theories, methods and tools in program comprehension: Past, present and future"
 Taskscapes: a topographical model of task context,M Kersten,"",1,"Theories, methods and tools in program comprehension: Past, present and future"
Component Substitution Process Model,J Rilling - 2008 - cradpdf.drdc-rddc.gc.ca,"",1,"Theories, methods and tools in program comprehension: Past, present and future"
Method to evaluate software protection based on attack modeling,"H Wang, D Fang, N Wang, Z Tang -   & 2013 IEEE  , 2013 - ieeexplore.ieee.org",Cited by 1,1,"Jasvir Nagra, Paolo Falcarin, Filippo Ricca, Marco Torchiano, and Paolo Tonella. The Effectivenes..."
 NS ,"LIN Dao-Miao, GU Hui - , 2012 - ecice06.com","",1,"Theories, methods and tools in program comprehension: Past, present and future"
Effects of Refactoring on Productivity in Relation to Code Understandability,E Ammerlaan - 2014 - repository.tudelft.nl,"",1,"Theories, methods and tools in program comprehension: Past, present and future"
Visualizacin de software orientada a comprensin de programas,"EA Miranda, M Bern, GA Montejano - XIV Workshop de  , 2012 - sedici.unlp.edu.ar","",1,"Theories, methods and tools in program comprehension: Past, present and future"
Locating Interested Code by Program Execution Paths with Debugger,JY Wang - 2013 - ir.lib.ncu.edu.tw,"",1,"Theories, methods and tools in program comprehension: Past, present and future"
Extraccin y anlisis de informacin esttica orientada a la comprensin de programas para Sistemas OO,"EA Miranda, MM Bern, DE Riesco - Ciencia y Tecnologa, 2014 - pub.palermo.edu","",1,"Theories, methods and tools in program comprehension: Past, present and future"
 C ,"  - , 2013 - cqvip.com","",1,"Theories, methods and tools in program comprehension: Past, present and future"
"","      - : , 2014 - cnki.com.cn","",1,"Theories, methods and tools in program comprehension: Past, present and future"
"","   - , 2007 - cqvip.com","",1,"Theories, methods and tools in program comprehension: Past, present and future"
Vers une approche automatique pour l'extraction des rgles d'affaires d'une application,G Chnard - 2007 - archipel.uqam.ca,"",1,"Theories, methods and tools in program comprehension: Past, present and future"
Extraccin de informacin dinmica en programacin orientada a objetos (Java),"H Bernardis, M Bern, D Riesco - XIII Workshop de  , 2011 - bibliotecadigital.ipb.pt","",1,"Theories, methods and tools in program comprehension: Past, present and future"
Documenting for Program Comprehension in Agile Software Development,F Kiss - 2011 - bada.hb.se,"",1,"Theories, methods and tools in program comprehension: Past, present and future"
DOUTORADO EM EDUCAO MATEMTICA,LS de Assis - sapientia.pucsp.br,"",1,"Theories, methods and tools in program comprehension: Past, present and future"
Compreensao de Programas Apoiada por uma Linguagem de Consulta em Cdigo Fonte,"DP Pinheiro, RG Ribeiro, AA Oliveira, MA Maia - lbd.dcc.ufmg.br","",1,"Theories, methods and tools in program comprehension: Past, present and future"
Extracting business logic from existing cobol programs as a basis for redevelopment,"HM Sneed -  , 2001. IWPC 2001. Proceedings. 9th International  , 2001 - ieeexplore.ieee.org",Cited by 41,1,Understanding program understanding
Facilitating program comprehension by mining association rules from source code,"C Tjortjis, L Sinos, P Layzell - Program Comprehension, 2003.  , 2003 - ieeexplore.ieee.org",Cited by 36,1,Understanding program understanding
Expert Maintainers' Strategies and Needs when Understanding Software: A Case Study Approach,"C Tjortjis, P Layzell -  , 2001. APSEC 2001. Eighth Asia-Pacific, 2001 - ieeexplore.ieee.org",Cited by 26,1,Understanding program understanding
Data mining source code to facilitate program comprehension: experiments on clustering data retrieved from C++ programs,"Y Kanellopoulos, C Tjortjis - Program Comprehension, 2004.  , 2004 - ieeexplore.ieee.org",Cited by 22,1,Understanding program understanding
An improved methodology on information distillation by mining program source code,"Y Kanellopoulos, C Makris, C Tjortjis - Data & Knowledge Engineering, 2007 - Elsevier",Cited by 16,1,Understanding program understanding
From system comprehension to program comprehension,"C Tjortjis, N Gold, P Layzell - Computer Software and  , 2002 - ieeexplore.ieee.org",Cited by 10,1,Understanding program understanding
Automatic relative debugging,AJ Searle - 2006 - eprints.qut.edu.au,Cited by 2,1,Understanding program understanding
